"core_id","cg_ids","tig_ids","fb_ids","rule_type","description","outcome_message","core_executable","cg_executability","overlap_type"
"CORE-000251","CG0067","","FB0614","Record Data","When survival status is completed as 'DEAD' in the SS dataset then a record should be present in the DS dataset where DSDECOD = 'DEATH' for the corres","SSTRESC in SS dataset is ""DEAD"", but a record is missing in DS dataset where DSDECOD = ""DEATH"".",TRUE,"predicate","true-duplicate"
"CORE-000252","CG0136","TIG0385","FB0605","Record Data","When a record is present in the DS dataset where DSDECOD = 'DEATH' then death flag (DTHFL) should be populated as 'Y' in the DM dataset for the corres","DSDECOD is 'DEATH' in DS dataset, but DTHFL in DM dataset is not ""Y"".",TRUE,"predicate","true-duplicate"
"CORE-000253","CG0135","TIG0384","FB0604","Record Data","When a record is present in the AE dataset where AESDTH = 'Y' then death flag (DTHFL) should be populated as 'Y' in the DM dataset for the correspondi","AESDTH is 'Y' in AE dataset, but DTHFL in DM dataset is not ""Y"".",TRUE,"predicate","true-duplicate"
"CORE-000254","CG0134","TIG0383","FB0603","Record Data","When a record is present in the AE dataset where AEOUT = 'FATAL' then death flag (DTHFL) should be populated as 'Y' in the DM dataset for the  corresp","AEOUT is 'FATAL' in AE dataset, but DTHFL in DM dataset is not ""Y"".",TRUE,"predicate","true-duplicate"
"CORE-000256","CG0210","TIG0429; TIG0062","","Record Data","Raise an error when ETCD = 'UNPLAN', SEUPDES = null","Missing value for SEUPDES, when ETCD='UNPLAN'",TRUE,"predicate","true-duplicate"
"CORE-000258","CG0062","TIG0336","","Record Data","Raise an error when --STRTPT is present in dataset and --STTPT is not present in dataset.","--STRTPT is present in dataset, but --STTPT is not present in dataset.",TRUE,"predicate","true-duplicate"
"CORE-000259","CG0171","","FB0613","Record Data","Date/time of collection of subject status in SS dataset where survival status (SSSTRESC) = 'DEAD' should be equal to or after the Date/Time of Death (","SSDTC in SS dataset where SSTRESC = 'DEAD' is not equal to or after the DTHDTC in the DM dataset.",TRUE,"predicate","true-duplicate"
"CORE-000260","CG0085","TIG0350","","Record Data","Raise an error when --PRESP does not equal 'Y' or is not empty.","--PRESP does not equal 'Y' or is not empty.",TRUE,"predicate","true-duplicate"
"CORE-000261","CG0060","TIG0334","","Record Data","Raise an error when --STTPT is present in dataset and --STRTPT is not present in dataset.","--STTPT is present in dataset, but --STRTPT is not present in dataset.",TRUE,"predicate","true-duplicate"
"CORE-000262","CG0226","TIG0439","","Record Data","Raise an error when RFSTDTC in DM is empty and --STRF is not empty.","RFSTDTC in DM dataset is empty but --STRF is completed.",TRUE,"predicate","true-duplicate"
"CORE-000264","CG0039","","","Record Data","Raise an error if primary SOC is used for analysis and -BODSYS is not equal to -SOC","Primary analysis used but --BODSYS and --SOC are not equal",TRUE,"predicate","true-duplicate"
"CORE-000266","CG0042","TIG0321","","Record Data","Select record where AESCAN and AESCONG and AESDISAB and AESDTH and AESHOSP and AESLIFE and AESOD and AESMIE ^= ""Y"" However, AESER ^= ""N""","If AESER = ""N"" then none of the seriousness criteria (AESCAN, AESCONG, AESDISAB, AESDTH, AESHOSP, AESLIFE, AESOD, AESMIE",TRUE,"predicate","true-duplicate"
"CORE-000267","CG0050","TIG0328","","Record Data","Raise an error when --DECOD is not populated but --PTCD is populated","--DECOD should be populated when --PTCD is populated",TRUE,"predicate","true-duplicate"
"CORE-000268","CG0049","TIG0327","FB0909","Record Data","--DECOD and --PTCD should have a one-to-one relationship.","--DECOD and --PTCD do not have a one-to-one relationship.",TRUE,"predicate","true-duplicate"
"CORE-000269","CG0031","TIG0312","","Record Data","Verify when VISIT is not null in any given domain and VISIT is planned (SVPRESP = 'Y'), then VISIT should be among TV.VISIT.","For a planned visit (SVPRESP = 'Y'), non-missing VISIT value must be among those present in TV.VISIT.",TRUE,"predicate","true-duplicate"
"CORE-000270","CG0033","TIG0314","","Record Data","Verify when VISITNUM is not null in any given domain and VISITNUM is planned (SVPRESP = 'Y'), then VISIT should be among TV.VISITNUM.","For a planned visit (SVPRESP = 'Y'), non-missing VISITNUM value must be among those present in TV.VISITNUM. in TV.VISITN",TRUE,"predicate","true-duplicate"
"CORE-000271","CG0009","TIG0294","","Record Data","Raise an error when EPOCH is not in TA.EPOCH","EPOCH is not in TA.EPOCH",TRUE,"predicate","true-duplicate"
"CORE-000272","CG0336","TIG0501","","Record Data","Raise an error when --CAT = DOMAIN.","--CAT is equal to DOMAIN.",TRUE,"narrative","core-is-better"
"CORE-000289","CG0181","TIG0410","","Record Data","Raise an error when LBORRES is not a continuous measurement and LBORNRHI is not empty. The interpretation of the guidance is that LBORRES is populated","LBORRES is not a continuous measurement but LBORNRHI is not empty.",TRUE,"narrative","core-is-better"
"CORE-000290","CG0180","TIG0409","","Record Data","Raise an error when LBORRES ^= continuous measurement and LBORNRLO is not empty. The interpretation of the guidance is that LBORRES is populated (not ","LBORRES is not a continuous measurement but LBORNRLO is not empty.",TRUE,"narrative","core-is-better"
"CORE-000291","CG0105","TIG0370","","Domain Presence Check","When EC exists, EXVAMT should not be used.","EXVAMT is present when EC exists.",TRUE,"predicate","true-duplicate"
"CORE-000292","CG0107","","","Domain Presence Check","When EC exists, EXVAMTU should not be used.","EXVAMTU is present when EC domain exists.",TRUE,"predicate","true-duplicate"
"CORE-000293","CG0205","TIG0425","","Dataset Metadata Check","Trigger error if length of dataset name is greater than 8","Length of dataset name of SUPP-- dataset is greater than 8.",TRUE,"predicate","true-duplicate"
"CORE-000294","CG0270","TIG0471","","Record Data","Trigger error when TSPARMCD = 'AGEMAX' and TSVAL ^= null and TSVAL does not conform to ISO 8601","TSVAL is not in ISO 8601 format",TRUE,"predicate","true-duplicate"
"CORE-000295","CG0550","TIG0638","","Record Data","When --STREFC is populated, --STREFN should also be populated.","--STREFN is null when --STREFC is populated.",TRUE,"predicate","true-duplicate"
"CORE-000296","CG0540","TIG0633","","Record Data","When ACTARMCD is populated, disposition data for subject must be present","There are no DS records for subject who was assigned treatment",TRUE,"narrative","core-is-better"
"CORE-000297","CG0501","","","Domain Presence Check","Raise an error when variable MIDS is present in any of the dataset and TM dataset is missing.","TM dataset is missing when MIDS variable is present in one of the dataset.",TRUE,"predicate","true-duplicate"
"CORE-000298","CG0182","TIG0411","","Record Data","Raise an error when LBORRES is not a continuous measurement and LBSTNRLO is not empty. The interpretation of the guidance is that LBORRES is populated","LBORRES is not a continuous measurment but LBSTNRLO is not empty.",TRUE,"narrative","core-is-better"
"CORE-000299","CG0183","TIG0412","","Record Data","Raise an error when LBORRES is not a continuous measurement and LBSTNRHI is not empty. The interpretation of the guidance is that LBORRES is populated","LBORRES is not a continuous measurement but LBSTNRHI is not empty.",TRUE,"narrative","core-is-better"
"CORE-000302","","","FB0920","Record Data","QNAM and QLABEL should have a one-to-one relationship.","QNAM and QLABEL do not have a one-to-one relationship.",TRUE,NA,"core-only"
"CORE-000303","","","FB0901","Record Data","--TESTCD and --TEST should have a one-to-one relationship.","--TESTCD and --TEST do not have a one-to-one relationship.",TRUE,NA,"core-only"
"CORE-000305","","","FB4005","Record Data","Collected Duration (--DUR) value should not be negative.","Negative value for --DUR.",TRUE,NA,"core-only"
"CORE-000308","","","FB4002","Record Data","Dose (--DOSE) value should not be negative","Negative value for --DOSE.",TRUE,NA,"core-only"
"CORE-000310","","","FB4001","Record Data","Age (AGE) value should not be negative","Negative value for AGE.",TRUE,NA,"core-only"
"CORE-000318","","","FB0902","Record Data","ARMCD and ARM should have a one-to-one relationship.","ARMCD and ARM do not have a one-to-one relationship.",TRUE,NA,"core-only"
"CORE-000321","","","FB3201","Record Data","When Date/Time of Collection (--DTC) is present in the dataset, then the Study Day of Visit/Collection/Exam (--DY) should also present in the dataset.","Study Day of Visit/Collection/Exam (--DY) variable is missing when Date/Time of Collection (--DTC) is present.",TRUE,NA,"core-only"
"CORE-000322","CG0066","","","Record Data","When DSCAT equals PROTOCOL MILESTONE, then DSTERM should be equal to DSDECOD","DSCAT equals PROTOCOL MILESTONE but DSTERM is not equal to DSDECOD",TRUE,"predicate","true-duplicate"
"CORE-000324","CG0234","TIG0443","","Record Data","Trigger error when --ENRTPT is not in ('BEFORE', 'COINCIDENT', 'ONGOING', 'UNKNOWN')","--ENRTPT is not in ('BEFORE', 'COINCIDENT', 'ONGOING', 'UNKNOWN')",TRUE,"predicate","true-duplicate"
"CORE-000326","CG0568","","","Record Data","Trigger error when EXMETHOD exists in the EX dataset for human clinical trials","EXMETHOD is not to be used with human clinical trials",TRUE,"predicate","true-duplicate"
"CORE-000328","","","FB3202","Record Data","Study Day of Start (--STDY) variable should be included into dataset, when Start Study Date/Time (--STDTC) variable is present.","The Study Day of Start of Observation (--STDY) is not present in the dataset when Start Date/Time of Observation (--STDT",TRUE,NA,"core-only"
"CORE-000329","CG0063","","","Record Data","Raise an error when multiple records within same USUBJID exist with DSCAT = DISPOSITION EVENT but EPOCH is empty","Multiple records within same USUBJID exist with DSCAT = DISPOSITION EVENT but EPOCH is empty",TRUE,"predicate","true-duplicate"
"CORE-000330","CG0122","","","Record Data","ACTARM value must match ARM value in Demographics when ARM equals ""Screen Failure"" or ""Not Assigned""","ARM should be equal to ACTARM when ARM is Screen Failure or Not Assigned.",TRUE,"predicate","true-duplicate"
"CORE-000331","CG0124; CG0125","","","Record Data","ACTARMCD values in Demographics are restricted to ARMCD values in Trial Arms when ACTARMCD is not equal to ""SCRNFAIL"", ""NOTASSGN"", ""NOTTRT"", or ""UNPLA","DM.ACTARMCD must equal SCRNFAIL, NOTASSGN, NOTTRT, or UNPLAN if the value is not present in TA.ARMCD",TRUE,"predicate","true-duplicate"
"CORE-000332","CG0193","","","Record Data","Raise an error when MBTESTCD=ORGANISM, MSSTRESC!='NO GROWTH', MBMETHOD!='GRAM STAIN' and MBRESCAT is empty","MBRESCAT is expected when MBTESTCD='ORGANISM', MSSTRESC!='NO GROWTH', MBMETHOD!='GRAM STAIN'",TRUE,"predicate","true-duplicate"
"CORE-000333","CG0215","","","Record Data","Raise an error when SVUPDES is null and SV.VISIT is not in TV.VISIT","SVUPDES is not populated or does not exist, but the VISIT does not equal a VISIT present in TV",TRUE,"predicate","true-duplicate"
"CORE-000334","CG0016","TIG0301; TIG0065","","Variable Metadata Check","Raise an error when an expected variable is not present in the dataset.","At least one expected variable is missing from dataset",TRUE,"narrative","core-is-better"
"CORE-000335","CG0280","","","Record Data","Raise an error when TSPARMCD = ""RANDQT"" and the value provided in TSVAL is not a number between 0 and 1.","TSPARMCD = ""RANDQT"" but TSVAL is not a number between 0 and 1.",TRUE,"narrative","core-is-better"
"CORE-000337","CG0140","TIG0386","","Record Data","Raise an error when multiple races are collected in SUPPDM but RACE in DM does not equal ""MULTIPLE"".","Multiple races are collected in SUPPDM but RACE in DM does not equal ""MULTIPLE"".",TRUE,"predicate","true-duplicate"
"CORE-000338","CG0457","","","Record Data","Raise an error when TSPARMCD = ""ACTSUB"" and the value provided in TSVAL is not an integer greater than 0.","TSPARMCD = ACTSUB but the value provided in TSVAL is not a positive integer.",TRUE,"predicate","true-duplicate"
"CORE-000339","CG0456","","","Record Data","Raise an error when TSPARMCD = FCNTRY and TSVCDREF is not equal to 'ISO 3166-1 alpha-3'","TSPARMCD = FCNTRY but TSVCDREF is not equal to 'ISO 3166-1 alpha-3'",TRUE,"predicate","true-duplicate"
"CORE-000340","CG0440","","","Record Data","Raise an error when TSPARMCD = ""PLANSUB"" and the value provided in TSVAL is not an integer greater than 0.","TSPARMCD = PLANSUB but the value provided in TSVAL is not a positive integer.",TRUE,"predicate","true-duplicate"
"CORE-000351","CG0151","TIG0392; TIG0255","","Record Data","USUBJID must be unique across all studies","USUBJID is not unique within study",TRUE,"predicate","true-duplicate"
"CORE-000352","CG0207","TIG0427","","Record Data","Trigger error where SEENDTC is not equal to SESTDTC of the next element.","SEENDTC is not equal to SESTDTC of the next element.",TRUE,"predicate","true-duplicate"
"CORE-000354","CG0007","TIG0292","","Record Data","Raise an error when the date portion of --DTC is an incomplete date or the date portion of DM.RFSTDTC is an incomplete date, but --DY is not empty","The date portion of --DTC is not complete date or the date portion of DM.RFSTDTC is not complete date, but --DY is not e",TRUE,"narrative","core-is-better"
"CORE-000355","CG0014","TIG0299; TIG0057","","Variable Metadata Check","Part A: Raise an error when a Required variable is not present in the dataset.","At least one required variable is missing from dataset",TRUE,"narrative","core-is-better"
"CORE-000356","CG0014","TIG0299; TIG0057","","Value Check with Dataset Metadata","Part B: Raise an error when a Required variable is null.","At least one Required variable has a null value",TRUE,"narrative","core-is-better"
"CORE-000357","CG0018","TIG0303","","Dataset Metadata Check","When a supplemental qualifier dataset is associated with a split dataset, the dataset name length must not be greater than 8 characters.","Supplemental qualifier dataset associated with a split dataset is greater than 8 characters in length",TRUE,"predicate","true-duplicate"
"CORE-000358","CG0022","TIG0306","","Record Data","Verify that when --LNKGRP is present in one domain it is also present in another domain.","LNKGRP variable is not found in any of the other domains.",TRUE,"predicate","true-duplicate"
"CORE-000361","CG0035","TIG0316","FB0919","Record Data","When VISITNUM is present in TV, VISIT and VISITNUM should have a one-to-one relationship.","VISIT and VISITNUM do not have a one-to-one relationship.",TRUE,"predicate","true-duplicate"
"CORE-000362","CG0037","","","Record Data","Raise an error when primary SOC is used for analysis and SOC Code is not equal to Body System Code","Primary analysis was used but --SOCCD and --BDSYCD are not equal",TRUE,"predicate","true-duplicate"
"CORE-000363","CG0068","TIG0338","","Record Data","When there are multiple informed consents obtained and DSDECOD = 'INFORMED CONSENT OBTAINED', the earliest DSSTDTC for each subject should be equal to","The earliest disposition date for ""INFORMED CONSENT OBTAINED"" is not equal to DM.RFICDTC",TRUE,"predicate","true-duplicate"
"CORE-000364","CG0073","","","Record Data","Raise an error when DSCAT = ""PROTOCOL MILESTONE"" but EPOCH is not equal to null.","EPOCH should be null if DSCAT is protocol milestone",TRUE,"predicate","true-duplicate"
"CORE-000365","CG0077","","","Record Data","MHCAT should not group all records.  If no smaller categorization can be applied, then it is not necessary to include or populate this variable.","MHCAT is grouping all records into one generic group. If no smaller categorization can be applied, then it is not necess",TRUE,"narrative","core-is-better"
"CORE-000366","CG0109","","","Record Data","Raise an error when subject has no records in EX but ACTARMCD is not equal to SCRNFAIL, NOTASSGN or NOTTRT.","Subject has no records in EX but ACTARMCD is not equal to SCRNFAIL, NOTASSGN or NOTTRT.",TRUE,"narrative","core-is-better"
"CORE-000367","CG0117; CG0118","","","Record Data","Raise an error when no TA.ARM exists for ACTARM in DM and ACTARM does not equal Screen Failure, Not Assigned, Not Treated, or Unplanned Treatment in D","ACTARM is not in TA.ARM, but ACTARM in DM does not equal Screen Failure, Not Assigned, Not Treated, or Unplanned Treatme",TRUE,"predicate","true-duplicate"
"CORE-000368","CG0120; CG0121","","","Record Data","ARM values in Demographics are restricted to ARM values in Trial Arms when not equal to ""Screen Failure"" or ""Not Assigned""","ARM is not in TA.ARM, but ARM in DM does not equal Screen Failure or Not Assigned.",TRUE,"predicate","true-duplicate"
"CORE-000369","CG0141","","","Record Data","Raise an error when RFENDTC is not null, but ACTARM is Screen Failure, Not Assigned, or Not Treated","RFENDTC must be null when ACTARM in (Screen Failure, Not Assigned, Not Treated).",TRUE,"narrative","core-is-better"
"CORE-000370","CG0143","TIG0387","","Record Data","DM.RFICDTC must equal the earliest DS.DSSTDTC when DSTERM indicates informed consent obtained.","DM.RFICDTC is not equal to the earliest DSSTDTC, when DSTERM indicates Informed consent obtained.",TRUE,"narrative","core-is-better"
"CORE-000371","CG0244","","","Record Data","Raise an error when ARM is ""Screen Failure"", ""Not Assigned"", ""Unplanned Treatment"" or ""Not Treated""","ARM is ""Screen Failure"", ""Not Assigned"", ""Unplanned Treatment"" or ""Not Treated""",TRUE,"predicate","true-duplicate"
"CORE-000372","CG0269","","","Record Data","For TS.TSPARMCD = ""ADDON"" records, TS.TSVAL value must equal ""N"" or ""Y"" when not missing","For TS.TSPARMCD = ""ADDON"" records, TS.TSVAL value must equal ""N"" or ""Y"" when not missing",TRUE,"predicate","true-duplicate"
"CORE-000373","CG0271","","","Record Data","For TS.TSPARMCD = ""RANDOM"" records, TS.TSVAL value must equal ""N"" or ""Y"" when not missing","For TS.TSPARMCD = ""RANDOM"" records, TS.TSVAL value must equal ""N"" or ""Y"" when not missing",TRUE,"predicate","true-duplicate"
"CORE-000374","CG0537","TIG0630","","Record Data","Trigger error when there is more than one record per subject per EPOCH","There is more than one record per subject per EPOCH",TRUE,"predicate","true-duplicate"
"CORE-000375","CG0202","","","Record Data","Raise an error when QORIG = ASSIGNED and QEVAL is not populated.","QORIG = ASSIGNED but QEVAL is not populated",TRUE,"predicate","true-duplicate"
"CORE-000376","CG0349","TIG0514","","Variable Metadata Check","Raise an error when the two first characters of a prefixed variable within a custom domain do not match the DOMAIN value.","First 2 characters of prefixed variable within custom domain do not match the DOMAIN value.",TRUE,"narrative","core-is-better"
"CORE-000377","CG0129","","","Record Data","ARMCD value must match ACTARMCD value in Demographics when ARMCD equals ""SCRFNFAIL"" or ""NOTASSGN""","DM.ARMCD must equal DM.ACTARMCD when subject is either a screen failure or not assigned to treatment",TRUE,"predicate","true-duplicate"
"CORE-000378","CG0142","","","Record Data","Raise an error when RFENDTC is null, but ACTARM is not Screen Failure, Not Assigned, or Not Treated","RFENDTC must not be null when ACTARM is a value other than Screen Failure, Not Assigned, or Not Treated.",TRUE,"predicate","true-duplicate"
"CORE-000379","CG0145","","","Record Data","Raise an error when RFSTDTC is not null, but ACTARM is either Screen Failure, Not Assigned, or Not Treated","RFSTDTC must be null when ACTARM in (Screen failure, Not Assigned, Not Treated).",TRUE,"narrative","core-is-better"
"CORE-000380","CG0146","","","Record Data","Raise an error when RFSTDTC is null, but ACTARM is neither Screen Failure, Not Assigned, nor Not Treated","RFSTDTC must not be null when ACTARM is not in (Screen Failure, Not Assigned, Not Treated.",TRUE,"predicate","true-duplicate"
"CORE-000384","CG0374","TIG0538","","Record Data","RELREC.RDOMAIN must represent a dataset that is present in the study.","RELREC.RDOMAIN does not represent a dataset present in the study",TRUE,"predicate","true-duplicate"
"CORE-000398","CG0303","","","Variable Metadata Check against Library Metadata","Raise an error when the variable label for an IG-variable does not correspond to the variable label in the Implementation Guide.","The label of the variable does not correspond to the label in the IG",TRUE,"narrative","core-is-better"
"CORE-000452","CG0432","","","Record Data","Raise an error when AGEU is empty, but AGE or AGETXT is not empty.","Missing value for AGEU, when AGE or AGETXT is provided",TRUE,"predicate","true-duplicate"
"CORE-000453","CG0433","","","Record Data","Raise an error when AGE is empty, but AGEU is not empty.","Missing value for AGE, when AGEU is provided",TRUE,"predicate","true-duplicate"
"CORE-000457","CG0373","TIG0537","","Record Data","Trigger error when SUPP--.RDOMAIN does not represent a dataset present in the study","SUPP--.RDOMAIN does not represent a dataset present in the study",TRUE,"predicate","true-duplicate"
"CORE-000467","CG0441","","","Record Data","Raise an error when TSPARMCD = STOPRULE and TSVAL is not completed.","TSVAL is missing when TSPARMCD = STOPRULE.",TRUE,"predicate","true-duplicate"
"CORE-000468","CG0276","","","Record Data","Raise an error when a record exists in TS where TSPARMCD = STYPE and TSVAL = INTERVENTIONAL but TSVAL for TSPARMCD = TRT is empty.","A record exists in TS where TSPARMCD = STYPE and TSVAL = INTERVENTIONAL but TSVAL for TSPARMCD = TRT is empty.",TRUE,"predicate","true-duplicate"
"CORE-000469","CG0277","","","Record Data","Raise an error when a record exists in TS where TSPARMCD = STYPE and TSVAL = INTERVENTIONAL but TSVAL for TSPARMCD = INTMODEL is empty.","A record exists in TS where TSPARMCD = STYPE and TSVAL = INTERVENTIONAL but TSVAL for TSPARMCD = INTMODEL is empty.",TRUE,"predicate","true-duplicate"
"CORE-000470","CG0278","","","Record Data","Raise an error when a record exists in TS where TSPARMCD = STYPE and TSVAL = INTERVENTIONAL but TSVAL for TSPARMCD = INTTYPE is empty.","A record exists in TS where TSPARMCD = STYPE and TSVAL = INTERVENTIONAL but TSVAL for TSPARMCD = INTTYPE is empty.",TRUE,"predicate","true-duplicate"
"CORE-000473","CG0272","","","Record Data","Raise an error when a record exists in TS where TSPARMCD = HLTSUBJI and TSVAL = Y but TSVAL for TSPARMCD = TDIGRP is not empty or does not equal HEALT","A record exists in TS where TSPARMCD = HLTSUBJI and TSVAL = Y but TSVAL for TSPARMCD = TDIGRP is not empty or does not e",TRUE,"narrative","core-is-better"
"CORE-000483","CG0455","","","Record Data","Raise an error when TSPARMCD = PCLAS but TSVCDREF is not equal to 'MED-RT'.","TSPARMCD = PCLAS but TSVCDREF does not equal 'MED-RT'.",TRUE,"predicate","true-duplicate"
"CORE-000484","CG0200","TIG0421","","Record Data","Within a subject, each unique RELID should be present on multiple RELREC records","Unique RELID is NOT present on multiple RELREC records within a subject.",TRUE,"narrative","core-is-better"
"CORE-000497","CG0279","","","Record Data","Raise an error when a record exists in TS where TSPARMCD = STYPE and TSVAL = INTERVENTIONAL but TSVAL for TSPARMCD = TPCLAS is empty but applicable.","A record exists in TS where TSPARMCD = STYPE and TSVAL = INTERVENTIONAL but TSVAL for TSPARMCD = PCLAS is empty when PCL",TRUE,"predicate","true-duplicate"
"CORE-000501","CG0216","","","Record Data","Raise an error if SVUPDES is not null when VISITDY is populated.","VISITDY is populated when SVUPDES is also populated.",TRUE,"predicate","true-duplicate"
"CORE-000502","CG0369","TIG0533","","Record Data","Raise an error when RDOMAIN is populated but the referenced RDOMAIN doesn't exist as a dataset in the present study","RDOMAIN does not represent a dataset present in the study.",TRUE,"narrative","core-is-better"
"CORE-000504","CG0283","","","Record Data","Raise an error when TSVAL for TSPARMCD=DCUTDTC is not a valid date/time","Invalid date for TSVAL for TSPARMCD = DCUTDTC (Data Cutoff Date)",TRUE,"predicate","true-duplicate"
"CORE-000505","CG0285","","","Record Data","Study Start Date (SSTDTC) value in the TS dataset should be populated in ISO 8601 format.","TSVAL where TSPARMCD = SSTDTC is not in ISO 8601 format.",TRUE,"predicate","true-duplicate"
"CORE-000506","CG0286","","","Record Data","Raise an error when TSVAL for TSPARMCD=SENDTC is not a valid date/time","Invalid date for TSVAL for TSPARMCD = SENDTC (Study End Date)",TRUE,"predicate","true-duplicate"
"CORE-000510","CG0017","","","Dataset Metadata Check","Split datasets (excluding supplemental qualifiers) is expected to have a have a length of 3 or 4 characters","Split dataset name is not 3 or 4 characters in length",TRUE,"predicate","true-duplicate"
"CORE-000515","CG0412","","","Record Data","Raise an error when DM.ACTARMCD does not equal ""SCRNFAIL"", ""NOTASSGN"" or ""NOTTRT"", and there are no DS records for the same subject","DM.ACTARMCD does not equal ""SCRNFAIL"", ""NOTASSGN"" or ""NOTTRT"" but there are no DS records for the same subject",TRUE,"narrative","core-is-better"
"CORE-000517","","","FB4003","Record Data","Total Daily Dose (--DOSTOT) value should not be negative.","Negative value for --DOSTOT.",TRUE,NA,"core-only"
"CORE-000518","","","FB4004","Record Data","Value for Treatment Vehicle Amount (--VAMT) should not be negative.","Negative value for --VAMT.",TRUE,NA,"core-only"
"CORE-000522","","","FB1401","Record Data","Category for Disposition Event (DSCAT) should be populated.","Missing DSCAT value for Disposition Event.",TRUE,NA,"core-only"
"CORE-000527","CG0209","TIG0428","","Record Data","Trigger error where element is not the last element and SEENDTC is null.","SEENDTC is null when element is not the last.",TRUE,"predicate","true-duplicate"
