"core_id","cg_ids","tig_ids","fb_ids","rule_type","description","outcome_message","core_executable","cg_executability","overlap_type"
"CORE-000529","CG0006","TIG0291; TIG0274; TIG0275","FB1603","Record Data","Raise an error when --DY is not calculated as per the study day algorithm as a non-zero integer value when the date portion of --DTC is complete and t","--DY is not correctly calculated even though the date portion of --DTC is complete, the date portion of RFSTDTC is compl",TRUE,"narrative","core-is-better"
"CORE-000530","CG0119","","","Record Data","Raise an error when ACTARM is Screen Failure or Not Assigned, and ACTARM does not equal ARM","ACTARM should be equal to ARM when ACTARM is Screen Failure or Not Assigned.",TRUE,"predicate","true-duplicate"
"CORE-000531","CG0126; CG0128","","","Record Data","ARMCD values in Demographics are restricted to ARMCD values in  Trial Arms when DM.ARMCD is not equal to ""SCRNFAIL"" or ""NOTASSGN""","DM.ARMCD must equal SCRNFAIL or NOTASSGN if the value is not present in TA.ARMCD",TRUE,"predicate","true-duplicate"
"CORE-000532","CG0275","","","Record Data","Raise an error when a record exists in TS where TSPARMCD = ADDON and TSVAL = Y but TSVAL for TSPARMCD = CURTRT is empty.","A record exists in TS where TSPARMCD = ADDON and TSVAL = Y but TSVAL for TSPARMCD = CURTRT is empty.",TRUE,"predicate","true-duplicate"
"CORE-000533","CG0138","","","Record Data","","A SUPP domain other than SUPPDM contains population flags (name fragments reserved)",TRUE,"narrative","core-is-better"
"CORE-000534","CG0248","TIG0452; TIG0148","","Record Data","TAETORD must be an integer","TAETORD is not an integer",TRUE,"predicate","true-duplicate"
"CORE-000535","CG0662; CG0620","TIG0066; TIG0661","","Record Data","Trigger error when the order of --SEQ is not chronological (based on --STDTC) within USUBJID","--SEQ is not chronological (based on --STDTC) within USUBJID",TRUE,"narrative","core-is-better"
"CORE-000538","CG0334","TIG0500","","Record Data","Trigger error when RDOMAIN does not match characters 5 and 6 of the Supplementary dataset name","RDOMAIN does not match characters 5 and 6 of the dataset name",TRUE,"narrative","core-is-better"
"CORE-000539","CG0332","TIG0498","","Dataset Metadata Check","Raise an error when split domains (i.e three/four-letter domain name) do not have a two-letter parent domain present in the study.","Split dataset is present but the two-Letter parent domain is missing.",TRUE,"narrative","core-is-better"
"CORE-000540","CG0333","TIG0499","","Dataset Metadata Check","Raise an error when parent domain referenced in Findings About dataset name is not present in the study.","Parent domain referenced in Findings About dataset name is not present in the study",TRUE,"narrative","core-is-better"
"CORE-000541","CG0372","TIG0536","","Record Data","Part B - Raise an error when IETESTCD > 8 chars or contains more than only letters, numbers and underscores, or starts with a number.","IETESTCD > 8 chars or contains more than only letters, numbers, underscores, or starts with a number.",TRUE,"narrative","core-is-better"
"CORE-000542","","TIG0280","FB3102","Record Data","Raise an error when --STRESC is populated with a numeric value, but --STRESN is not populated, or --STRESN is not equal to --STRESC.","--STRESC is numeric but --STRESN is not populated or not equal to --STRESC.",TRUE,NA,"core-only"
"CORE-000543","CG0127","","","Record Data","Raise an error when ACTARMCD equals ""SCRFNFAIL"" or ""NOTASSGN"" but ARMCD doesn't equal ACTARMCD.","ARMCD does not equal ACTARMCD when subject is either a screen failure or not assigned to treatment",TRUE,"predicate","true-duplicate"
"CORE-000544","CG0028","","","Record Data","Excluding TS.TSSEQ, raise an error when --SEQ is not a unique number per USUBJID per domain, or not a unique number per POOLID per domain, including w","--SEQ is not a unique number per USUBJID per domain, nor a unique number per POOLID per domain, including when the domai",TRUE,"narrative","core-is-better"
"CORE-000550","CG0013; CG0351","TIG0298","","Variable Metadata Check","Raise an error when a variable is not an allowed variable for an Observation Class","Variables not listed in the Model List of Allowed Variables for Observation Class should be in SUPPQUAL.",TRUE,"narrative","core-is-better"
"CORE-000552","CG0220","TIG0434","","Record Data","Study day must be calculated using the algorithm detailed in the SDTMIG.","--STDY is not properly calculated per study day algorithm",TRUE,"predicate","true-duplicate"
"CORE-000553","CG0222","TIG0436","","Record Data","Study day must be calculated using the algorithm detailed in the SDTMIG.","--ENDY is not properly calculated per study day algorithm",TRUE,"predicate","true-duplicate"
"CORE-000562","CG0273","","","Record Data","Raise an error when a record exists in TS where TSPARMCD = HLTSUBJI and TSVAL = N but TSVAL for TSPARMCD = TDIGRP is empty.","A record exists in TS where TSPARMCD = HLTSUBJI and TSVAL = N but TSVAL for TSPARMCD = TDIGRP is empty.",TRUE,"predicate","true-duplicate"
"CORE-000563","CG0282","","","Record Data","TSVAL must be either Y or N when TSPARMCD is ADAPT","TSVAL must be either Y or N when TSPARMCD is ADAPT",TRUE,"predicate","true-duplicate"
"CORE-000564","CG0458","","","Record Data","Raise an error when TSPARMCD = INDIC or TSPARMCD = TDIGRP but TSVCDREF is not equal to 'SNOMED'.","TSPARMCD = INDIC or TSPARMCD = TDIGRP but TSVCDREF is not equal to 'SNOMED'.",TRUE,"predicate","true-duplicate"
"CORE-000571","CG0024","TIG0307","","Record Data","Verify that when --LNKID is present in one domain it is also present in another domain.","LNKID variable is only found in one domain.",TRUE,"predicate","true-duplicate"
"CORE-000572","CG0235","TIG0444","","Record Data","Trigger error when --ENRTPT is not in ('BEFORE', 'COINCIDENT', 'ONGOING', 'AFTER', 'UNKNOWN')","--ENRTPT is not in ('BEFORE', 'COINCIDENT', 'ONGOING', 'AFTER', 'UNKNOWN')",TRUE,"predicate","true-duplicate"
"CORE-000575","CG0219","TIG0266; TIG0433","","Variable Metadata Check","There must be at least one timing variable for any of the domains based on the three general observation classes","No timing variable is provided",TRUE,"narrative","core-is-better"
"CORE-000579","CG0408","","","Dataset Metadata Check","Raise an error when a dataset has no records.","Dataset has no record.",TRUE,"narrative","core-is-better"
"CORE-000580","CG0325","TIG0495","","Record Data","The combination of TESTRL, TEENRL, and TEDUR must be unique for each ETCD.","The combination of TESTRL, TEENRL, and TEDUR is not unique for each ETCD.",TRUE,"predicate","true-duplicate"
"CORE-000581","CG0368","TIG0532","","Domain Presence Check","DM dataset should be present.","DM dataset is missing.",TRUE,"predicate","true-duplicate"
"CORE-000582","CG0262","","","Record Data","Raise an error when TSVAL(n+1) ^= null and TSVALn = null","TSVALn is null when TSVAL(n+1) is populated.",TRUE,"narrative","core-is-better"
"CORE-000585","CG0313","","","Record Data","Raise an error when one of the following variables; STUDYID, DOMAIN, USUBJID (or POOLID) or --SEQ is not present in the dataset.","One of following variables is not present in the dataset; STUDYID, DOMAIN, USUBJID (or POOLID) or --SEQ.",TRUE,"narrative","core-is-better"
"CORE-000586","CG0398","","","Record Data","Raise an error when DSCAT = DISPOSITION EVENT and there is more than one record per subject for an EPOCH","Multiple records exist within the same EPOCH for a subject when DSCAT = DISPOSITION EVENT",TRUE,"predicate","true-duplicate"
"CORE-000587","CG0284","","","Record Data","Check that TVAL is an integer > 0 when TSPARMCD is NARMS","TSVAL must be an integer greater than zero when TSPARMCD is NARMS",TRUE,"predicate","true-duplicate"
"CORE-000594","CG0359","TIG0524; TIG0205","","Variable Metadata Check","Raise an error when a variable label is not in title case","Variable label is not in title case.",TRUE,"narrative","core-is-better"
"CORE-000597","CG0043","TIG0322","","Record Data","When SUPPAE.QNAM=AESOSP is present, a record with AESMIE=Y should be present","Missing AESMIE=Y where SUPPAE.QNAM=AESOSP",TRUE,"predicate","true-duplicate"
"CORE-000598","CG0413","TIG0568; TIG0037","","Dataset Metadata Check","The dataset name must begin with the DOMAIN value.","Dataset name does not begin with DOMAIN value",TRUE,"narrative","core-is-better"
"CORE-000616","","","FB4403","Record Data","When Planned Start of Assessment Interval (--STINT) is populated, Time Point Reference (--TPTREF) should also be populated.","--STINT is populated, but --TPTREF is missing.",TRUE,NA,"core-only"
"CORE-000642","","","FB4404","Record Data","When Planned End of Assessment Interval (--ENINT) is populated, Time Point Reference (--TPTREF) should also be populated.","--ENINT is populated, but --TPTREF is missing.",TRUE,NA,"core-only"
"CORE-000643","","","FB2601","Record Data","Records with a baseline flag (--BLFL) have a non missing value in character standard result variable (--STRESC)","BLFL is set to ""Y"", but no value for STRESC is provided",TRUE,NA,"core-only"
"CORE-000655","","","FB2501","Record Data","Values in ARMCD and ACTARMCD should match","Values between ARMCD and ACTARMCD are not matching",TRUE,NA,"core-only"
"CORE-000656","","","FB2502","Record Data","Values in ARM and ACTARM should match","Values between ARM and ACTARM are not matching",TRUE,NA,"core-only"
"CORE-000657","","","FB3409","Record Data","When Adverse Event Outcome (AEOUT) is populated with 'NOT RECOVERED/NOT RESOLVED', then the End Date/Time of Adverse Event (AEENDTC) should not be pop","AEENDTC is populated, when AEOUT = NOT RECOVERED/NOT RESOLVED.",TRUE,NA,"core-only"
"CORE-000658","","","FB3412","Record Data","Date/Time of Informed Consent (RFICDTC) should be prior or equal to the Date/Time of First Study Treatment (RFXSTDTC).","RFICDTC falls after RFXSTDTC.",TRUE,NA,"core-only"
"CORE-000659","","","FB3410","Record Data","When Adverse Event Outcome (AEOUT) is populated with RECOVERED/RESOLVED, then the End Date/Time of Adverse Event (AEENDTC) should be populated.","AEENDTC is missing, when AEOUT = RECOVERED/RESOLVED.",TRUE,NA,"core-only"
"CORE-000672","","","FB3901","Record Data","Normal Range Upper Limit-Standard Units (--STNRHI) should be greater than the Normal Range Lower Limit-Standard Units (--STNRLO).","--STNRHI is less than or equal to --STNRLO.",TRUE,NA,"core-only"
"CORE-000679","","","FB0608","Record Data","When Death flag (DTHFL) in the DM dataset is populated as 'Y' then a record should be present in the DS dataset where DSDECOD = 'DEATH' for the corres","DTHFL in DM dataset is ""Y"" but a record is missing in DS dataset where DSDECOD = ""DEATH"".",TRUE,NA,"core-only"
"CORE-000685","CG0571","","FB0923","Record Data","VISITNUM is present in the dataset and --TPTREF is not present in the dataset then --TPT and --TPTNUM should have a one-to-one relationship per unique","--TPT and --TPTNUM do not have a one-to-one relationship per unique value of VISITNUM.",TRUE,"narrative","core-is-better"
"CORE-000686","CG0572","","FB0924","Record Data","VISITNUM not present in dataset and --TPTREF present in dataset then --TPT and --TPTNUM should have a one-to-one relationship per unique values of --T","--TPT and --TPTNUM do not have a one-to-one relationship per unique value of --TPTREF.",TRUE,"narrative","core-is-better"
"CORE-000689","CG0573","","FB0925","Record Data","VISITNUM and --TPTREF are present then --TPT and --TPTNUM should have a one-to-one relationship per unique combination of VISITNUM and --TPTREF values","--TPT and --TPTNUM do not have a one-to-one relationship per unique combination of VISITNUM and --TPTREF values.",TRUE,"narrative","core-is-better"
"CORE-000699","","","FB3001","Record Data","Standard units should be consistent within the same assessment (having the same --TESTCD, --CAT, --SCAT, --SPEC, --METHOD values)","Standards units are inconsistent within the same test (category, sub-category, specimen and method)",TRUE,NA,"core-only"
"CORE-000700","","","FB3204","Record Data","When Study Day of Visit/Collection/Exam (--DY) is present in the dataset, then the Date/Time of Collection (--DTC) should also be present in the datas","Date/Time of Collection (--DTC) variable is missing when Study Day of Visit/Collection/Exam (--DY) is present.",TRUE,NA,"core-only"
"CORE-000701","","","FB2201","Record Data","EPOCH should be populated for clinical subject-level observations.","EPOCH is missing for clinical subject-level observation.",TRUE,NA,"core-only"
"CORE-000705","","","FB0610","Record Data","When Death flag (DTHFL) in the DM dataset is populated as 'Y' then Date/Time of Death (DTHDTC)should be populated in the DM dataset for the correspond","DTHFL is ""Y"", but DTHDTC is not populated in the DM dataset.",TRUE,NA,"core-only"
"CORE-000706","","","FB0906","Record Data","--LLTCD and --LLT should have a one-to-one relationship.","--LLTCD and --LLT do not have a one-to-one relationship.",TRUE,NA,"core-only"
"CORE-000707","","","FB3208","Record Data","Study Day of Visit/Collection/Exam (--DY) should be less than or equal to Study Day of End of Observation (--ENDY).","--DY is greater than --ENDY.",TRUE,NA,"core-only"
"CORE-000708","","","FB3207","Record Data","When Study Day of End of Observation (--ENDY) is present in the dataset, then the End Date/Time of Observation (--ENDTC) should also be present in the","--STDY is greater than --ENDY.",TRUE,NA,"core-only"
"CORE-000709","","","FB0607","Record Data","When a record is present in the CE dataset where CETERM or CEDECOD  = 'DEATH' then death flag (DTHFL) should be populated as 'Y' in the DM dataset for","CETERM or CEDECOD is 'DEATH' in CE dataset, but DTHFL in DM dataset is not ""Y"".",TRUE,NA,"core-only"
"CORE-000710","CG0233","TIG0442","","Record Data","Trigger error when --STRTPT is not in ('BEFORE', 'COINCIDENT', 'AFTER', 'UNKNOWN') and --STTPT is prior to the date of collection or assessment.","--STRTPT is not in ('BEFORE', 'COINCIDENT', 'AFTER', 'UNKNOWN')",TRUE,"predicate","true-duplicate"
"CORE-000711","","","FB3404","Record Data","Subject Reference Start Date/Time (RFSTDTC) should be prior or equal to the Subject Reference End Date/Time (RFENDTC).","RFSTDTC falls after RFENDTC.",TRUE,NA,"core-only"
"CORE-000712","CG0370","TIG0534","","Record Data","Part A - Raise and error when IDVAR in SUPP-- is not populated with a valid variable from the dataset referenced in RDOMAIN.","Value for IDVAR in SUPP-- does not represent a variable present in the dataset referenced in RDOMAIN.",TRUE,"narrative","core-is-better"
"CORE-000713","","","FB3411","Record Data","Date/Time of Informed Consent (RFICDTC) should be prior or equal to the Subject Reference Start Date/Time (RFSTDTC).","RFICDTC falls after RFSTDTC.",TRUE,NA,"core-only"
"CORE-000714","","","FB3408","Record Data","Date/Time of First Study Treatment (RFXSTDTC) variable value should be prior or equal to the Date/Time of Last Study Treatment (RFXENDTC).","RFXSTDTC falls after RFXENDTC.",TRUE,NA,"core-only"
"CORE-000716","","","FB0911","Record Data","--SOCCD and --SOC should have a one-to-one relationship.","--SOCCD and --SOC do not have a one-to-one relationship.",TRUE,NA,"core-only"
"CORE-000717","","","FB3401","Record Data","Start Date/Time of Adverse Event (AESTDTC) should be prior or equal to the Start Date/Time of the latest Disposition Event (DSSTDTC).","AESTDTC falls after the last DSSTDTC.",TRUE,NA,"core-only"
"CORE-000718","","","FB3209","Record Data","Start Date/Time of Observation (--STDTC) should be prior or equal to the End Date/Time of Observation (--ENDTC).","--STDTC falls after  --ENDTC.",TRUE,NA,"core-only"
"CORE-000719","","","FB0908","Record Data","--HLGTCD and --HLGT should have a one-to-one relationship.","--HLGTCD and --HLGT do not have a one-to-one relationship.",TRUE,NA,"core-only"
"CORE-000720","","","FB3406","Record Data","Date/Time of Collection (--DTC) variable value should be prior or equal to Date/Time of End of Participation (RFPENDTC).","--DTC falls after RFPENDTC.",TRUE,NA,"core-only"
"CORE-000723","","","FB0907","Record Data","--HLTCD and --HLT should have a one-to-one relationship.","--HLTCD and --HLT do not have a one-to-one relationship.",TRUE,NA,"core-only"
"CORE-000726","","","FB5701","Record Data","When Ethnicity was collected and it was not mapped as ""HISPANIC OR LATINO"" or ""NOT HISPANIC OR LATINO"".","Ethnicity has been collected but the values is not mapped to ""HISPANIC OR LATINO"" or ""NOT HISPANIC OR LATINO""",TRUE,NA,"core-only"
"CORE-000728","","","FB0904","Record Data","TSVALCD and TSVAL should have a one-to-one relationship.","TSVALCD and TSVAL do not have a one-to-one relationship.",TRUE,NA,"core-only"
"CORE-000729","","","FB0912","Record Data","INVID and INVNAM shoumd have a one-to-one relationship.","INVNAM and INVID do not have a one-to-one relationship.",TRUE,NA,"core-only"
"CORE-000730","CG0438","","","Record Data","When TSPARMCD is equal to AGEMIN and TSVAL is not null, TSVAL should conform to ISO 8601","TSVAL does not conform to ISO 8601",TRUE,"narrative","core-is-better"
"CORE-000731","CG0439","","","Record Data","When TSPARMCD = LENGTH and TSVAL ^= NULL, TSVAL needs to conform to ISO 8601 time period","TSVAL is not NULL and does not conform to ISO 8601 time period",TRUE,"narrative","core-is-better"
"CORE-000732","","","FB3103","Record Data","--STRESC is not populated with a numeric value, but --STRESN is not empty.","--STRESC is not numeric but --STRESN is not empty",TRUE,NA,"core-only"
"CORE-000733","CG0281","","","Record Data","At least one observation where TSPARMCD = TRT is present and there is only one investigational treatment","TSPARMCD = RANDQT record is not present",TRUE,"narrative","core-is-better"
"CORE-000735","CG0444","","","Record Data","When TSPARMCD is equal to COMPTRT, CURTRT or TRT, TSVCDREF should equal UNII","Throw error when TSPARMCD is equal to COMPTRT, CURTRT, or TRT and TSVCDREF ^= UNII",TRUE,"predicate","true-duplicate"
"CORE-000736","","","FB1116","Record Data","Either AGE or AGETXT is in the list of TSPARMCDs with TSVAL populated, not both.","AGE and AGETXT are in the list of TSPARAMCDs with TSVAL populated.",TRUE,NA,"core-only"
"CORE-000739","CG0407","","","Domain Presence Check","Trigger error when study includes protocol-specified study treatment and EX is not present","EX is not present in study when study includes protocol-specified study treatment",TRUE,"narrative","core-is-better"
"CORE-000740","CG0287","","","Record Data","A required value of TSPARMCD is not found","A required value of TSPARMCD is not found",TRUE,"narrative","core-is-better"
"CORE-000741","","","FB1111","Record Data","The set  ('INTMODEL’, 'INTTYPE','PCLASS') is not in the list of TSPARAMCD with TSVAL populated.","The set  ('INTMODEL’, 'INTTYPE','PCLASS') is not in the list of TSPARAMCD with TSVAL populated.",TRUE,NA,"core-only"
"CORE-000742","","","FB1110","Record Data","TSVALNF is not equal to NA when TSPARAMCD=INDIC","TSVALNF is not equal to NA when TSPARAMCD=INDIC",TRUE,NA,"core-only"
"CORE-000743","","","FB0918","Record Data","IETESTCD and IETEST should have a one-to-one relationship.","IETESTCD and IETEST do not have a one-to-one relationship.",TRUE,NA,"core-only"
"CORE-000744","CG0174","TIG0403","","Record Data","Raise an error when a related record is present in the parent domain dataset but FAOBJ is not equal to the --TERM, --TRT or --DECOD of the parent doma","Related record is present in the parent domain dataset but FAOBJ is not equal to the ""TERM"", ""TRT"" or ""DECOD"" of the par",TRUE,"blocker:requires-dynamic-parent-domain-link-op","cg-is-better"
"CORE-000745","","","FB0915","Record Data","OIPARMCD and OIPARM should have a one-to-one relationship.","OIPARMCD and OIPARM do not have a one-to-one relationship.",TRUE,NA,"core-only"
"CORE-000746","","","FB5801","Record Data","When ethnicity term 'Spanish origin' is collected (SUPPDM.CETHNIC), it should be mapped to Ethnicity (ETHNIC) 'HISPANIC OR LATINO' in the DM dataset","Ethnicity Term 'Spanish origin' (SUPPDM.CETHNIC) is collected but is not mapped as ETHNIC = HISPANIC OR LATINO.",TRUE,NA,"core-only"
"CORE-000747","","","FB6001","Record Data","When Race Term 'Haitian' or 'Negro' (SUPPDM.CRACE) is collected, it should be mapped to Race (RACE) 'BLACK OR AFRICAN AMERICAN' in the DM dataset.","Race Term 'Haitian' or 'Negro' is collected (SUPPDM.CRACE) but is not mapped to RACE = BLACK OR AFRICAN AMERICAN in DM d",TRUE,NA,"core-only"
"CORE-000757","CG0602","TIG0656","","Record Data","When findings are collected about an intervention, and the interventions parent record exists and --DECOD = null, FAOBJ should be equal to --TRT.","Interventions parent record exists and --DECOD = null, but FAOBJ is not equal to --TRT.",TRUE,"narrative","core-is-better"
"CORE-000758","CG0534","TIG0627","","Record Data","Raise an error when milestone associated with RFSTDTC is start of treatment and ARMNRS is not null and different from 'UNPLANNED TREATMENT', but RFSTD","Milestone associated with RFSTDTC is start of treatment and ARMNRS is not null and different from 'UNPLANNED TREATMENT',",TRUE,"narrative","core-is-better"
"CORE-000760","","","FB3413","Record Data","Date/Time of First Challenge Agent Admin (RFCSTDTC) should be prior or equal to the Date/Time of Last Challenge Agent Admin (RFCENDTC).","RFCSTDTC falls after RFCENDTC.",TRUE,NA,"core-only"
"CORE-000761","CG0289","","","Record Data","Trigger error when TSVCDREF = 'CDISC' and TSVCDVER is not a valid published version (date)","TSVCDVER is not a valid published version (date)",TRUE,"predicate","true-duplicate"
"CORE-000763","CG0232","TIG0441","","Record Data","Trigger error when --STRTPT is not in ('BEFORE', 'COINCIDENT', 'UNKNOWN')","--STTPT is equal to the date of collection or assessment but --STRTPT is not in ('BEFORE', 'COINCIDENT',  'UNKNOWN').",TRUE,"predicate","true-duplicate"
"CORE-000765","","","FB2401","Dataset Metadata Check","The submitted dataset is larger than 5 GB","The submitted dataset is larger than 5 GB",TRUE,NA,"core-only"
"CORE-000766","CG0601","","","Record Data","When findings are collected, and the Events parent record exists and --DECOD is null, FAOBJ should not be equal to --TERM","Related record is present in the parent domain dataset and ""Other, specify"" value was coded.",TRUE,"narrative","core-is-better"
"CORE-000767","CG0603","","","Record Data","When findings are collected, and the parent record exists and --DECOD is not null, FAOBJ should not be equal to --DECOD","Parent record exists and --DECOD is not null, but FAOBJ is not equal to --DECOD.",TRUE,"narrative","core-is-better"
"CORE-000774","","","FB4202","Record Data","When a test is not done (--STAT = NOT DONE), the Reason Not Done (--REASND) should be populated.","--STAT = NOT DONE, but --REASND is missing.",TRUE,NA,"core-only"
"CORE-000776","","","FB3203","Record Data","When End Date/Time of Observation (--ENDTC) is present in the dataset, then the Study Day of End of Observation (--ENDY) should also be present in the","Study Day of End of Observation (--ENDY) variable is missing when End Date/Time of Observation (--ENDTC) is present.",TRUE,NA,"core-only"
"CORE-000777","CG0502","","","Domain Presence Check","Raise an error when variable RELMIDS is present in any of the dataset and TM dataset is missing in a study.","TM dataset is missing when RELMIDS variable is present in any of the dataset.",TRUE,"predicate","true-duplicate"
"CORE-000778","CG0650","","","Dataset Metadata Check","When an Associated Persons non-supplemental qualifier dataset is associated with a split dataset, the dataset name length must be greater than 4 and l","Associated Persons non-supplemental qualifier dataset associated with a split dataset does not have a dataset name with ",TRUE,"narrative","core-is-better"
"CORE-000779","CG0376","","","Record Data","TDSTOFF must be equal to 0 or a positive value in ISO 8601 Duration format","TDSTOFF is not equal to zero or a positive value in ISO 8601 Duration format",TRUE,"predicate","true-duplicate"
"CORE-000783","CG0314","","","Record Data","Raise an error when SUPP--.QNAM is present in dataset, but value of SUPP--.QNAM is equal to a variable name defined in the corresponding SDTM version.","SUPP--.QNAM is present in the dataset, but the value of SUPP--.QNAM equals a variable name defined in the corresponding ",TRUE,"narrative","core-is-better"
"CORE-000784","CG0217","TIG0431","","Record Data","Raise an error when variable TAETORD values don't match between Subject Visits (SV) and Subject Elements (SE) datasets.","TAETORD values don't match between Subject Visits (SV) and Subject Elements (SE) datasets.",TRUE,"predicate","true-duplicate"
"CORE-000785","CG0429","TIG0583","","Record Data","Part B - Raise an error when IESCAT is not empty, but IECAT is empty.","IECAT should not be null when IESCAT is populated",TRUE,"predicate","true-duplicate"
"CORE-000786","CG0430","TIG0584","","Record Data","Part B - Raise an error when IESCAT exists in a dataset, but IECAT does not exist.","IESCAT exists in a dataset, but IECAT does not exist.",TRUE,"predicate","true-duplicate"
"CORE-000787","CG0291","","","Record Data","Raise an error when TSVALNF is empty and TSVAL is populated with values or synonyms of values in the ISO 21090 null flavor codelist (or other terms th","TSVAL is populated with an ISO 21090 null flavor or null flavor description.",TRUE,"narrative","core-is-better"
"CORE-000790","","","FB2505","Record Data","If a subject is assigned to an arm, the subject should have a record in EX.","Subject is assigned to an arm code (randomized) but has no record in EX.",TRUE,NA,"core-only"
"CORE-000791","","","FB0903","Record Data","ACTARMCD and ACTARM should have a one-to-one relationship.","ACTARMCD and ACTARM do not have a one-to-one relationship.",TRUE,NA,"core-only"
