"core_id","cg_ids","tig_ids","fb_ids","rule_type","description","outcome_message","core_executable","cg_executability","overlap_type"
"CORE-000001","CG0176","TIG0405","","Record Data","Raise an error when IECAT is equal to 'INCLUSION' and IEORRES is not equal to 'N'.","IEORRES is not equal to 'N' when IECAT equals 'INCLUSION'.",TRUE,"predicate","true-duplicate"
"CORE-000002","CG0208","","","Record Data","Raise an error when SESTDTC is null.","SESTDTC is required.",TRUE,"predicate","true-duplicate"
"CORE-000003","CG0299","","","Record Data","Raise an error when TRLOC is present.","TRLOC is present when TRLOC is not included in the TR domain.",TRUE,"predicate","true-duplicate"
"CORE-000004","CG0101","TIG0366","","Record Data","When ECOCCUR indicates no dose, then ECDOSE needs to be null or > 0; it cannot be used to indicate a dose wasn't taken.","ECOCCUR indicates dose was not given, but ECDOSE is not blank or has a value less than or equal to 0",TRUE,"narrative","core-is-better"
"CORE-000005","CG0102","","","Record Data","When EXTRT is PLACEBO, EXDOSE must equal 0","EXTRT is PLACEBO, but EXDOSE is not equal to 0.",TRUE,"predicate","true-duplicate"
"CORE-000006","CG0131","TIG0381","","Record Data","Raise an error when DTHFL ^= ""Y"" and not null","DTHFL is not ""Y"" or null",TRUE,"predicate","true-duplicate"
"CORE-000007","CG0435","TIG0587","FB0606","Record Data","When Date/Time of Death (DTHDTC) in the DM dataset is populated then death flag (DTHFL) should be populated as 'Y' in the DM dataset for the correspon","DTHDTC is populated but DTHFL in DM dataset is not ""Y"".",TRUE,"predicate","true-duplicate"
"CORE-000008","CG0132","","FB0601","Record Data","When survival status is completed as 'DEAD' in the SS dataset then death flag (DTHFL) should be populated as 'Y' in the DM dataset for the correspondi","SSTRESC in SS dataset is ""DEAD"", but DTHFL in DM dataset is not ""Y"".",TRUE,"predicate","true-duplicate"
"CORE-000009","CG0152","TIG0393; TIG0061","","Record Data","Verify that ELEMENT value is blank when ETCD is equal to UNPLAN","ELEMENT variable has a non-null value when ETCD has a value of 'UNPLAN'",TRUE,"predicate","true-duplicate"
"CORE-000010","CG0153","TIG0394","","Record Data","Verify ARMCD value length is <= 20","ARMCD value length is greater than 20",TRUE,"predicate","true-duplicate"
"CORE-000011","CG0175","TIG0404","","Record Data","Raise an error when IECAT is equal to 'EXCLUSION' and IEORRES is not equal to 'Y'.","IEORRES is not equal to 'Y' when IECAT equals 'EXCLUSION'.",TRUE,"predicate","true-duplicate"
"CORE-000012","CG0040","TIG0319","","Record Data","Raise an error when AEOCCUR exists in AE dataset.","AEOCCUR is present in AE dataset.",TRUE,"predicate","true-duplicate"
"CORE-000013","CG0044","TIG0323","","Record Data","Raise an error when AESTAT is present in AE dataset.","AESTAT variable is present in AE dataset.",TRUE,"predicate","true-duplicate"
"CORE-000014","CG0087","TIG0352","","Record Data","Raise an error when --PRESP is not equals to ""Y"" and --OCCUR is present in dataset or --STAT is equal to ""NOT DONE"" and --OCCUR is not blank","--OCCUR should only be provided when --PRESP is equal to ""Y"".",TRUE,"predicate","true-duplicate"
"CORE-000015","CG0088","TIG0353","","Record Data","Raise an error when --PRESP does not exists in a dataset and --OCCUR exist.","--PRESP is missing in dataset when --OCCUR is present.",TRUE,"predicate","true-duplicate"
"CORE-000016","CG0089","TIG0354","","Record Data","Raise an error when --OCCUR is not empty and --PRESP is not equal to ""Y"".","--PRESP should be populated as ""Y"" when --OCCUR is provided.",TRUE,"predicate","true-duplicate"
"CORE-000017","CG0166","TIG0398","","Record Data","Raise an error when RDOMAIN is null when IDVARVAL is not null.","RDOMAIN has a missing value when IDVARVAL has a non-missing value.",TRUE,"predicate","true-duplicate"
"CORE-000018","CG0086","TIG0351","","Record Data","Raise an error when --PRESP is equal to ""Y"", --STAT is blank, --OCCUR is present in dataset and --OCCUR is blank","--OCCUR is blank when --PRESP is equal to ""Y"" and --STAT is not provided.",TRUE,"predicate","true-duplicate"
"CORE-000019","CG0311","TIG0486; TIG0211","","Variable Metadata Check","Raise and error if Variable label length > 40 characters","Variable label length should be less than or equal to 40 characters",TRUE,"predicate","true-duplicate"
"CORE-000020","CG0206","TIG0426","","Record Data","Raise an error when ETCD=""UNPLAN"" and TAETORD is not null.","TAETORD should be null when ETCD = 'UNPLAN'.",TRUE,"predicate","true-duplicate"
"CORE-000021","CG0397","TIG0559","","Record Data","Raise an error when the value for --STRESC is null.","--STRESC should not be blank when either --ORRES is provided or --DRVFL = 'Y' .",TRUE,"predicate","true-duplicate"
"CORE-000022","CG0041","TIG0320","","Record Data","Raise an error when AESCAN, AESCONG, AESDISAB, AESDTH, AESHOSP, AESLIFE, AESOD or AESMIE = 'Y' and AESER = 'N' or is empty.","At least one of the Seriousness criteria (AESCAN, AESCONG, AESDISAB, AESDTH, AESHOSP, AESLIFE, AESOD or AESMIE)  = 'Y', ",TRUE,"predicate","true-duplicate"
"CORE-000023","CG0084","TIG0349","","Record Data","Raise an error when --TOXGR is not present in dataset, but --TOX is present","--TOX present in dataset even though --TOXGR is not",TRUE,"predicate","true-duplicate"
"CORE-000024","CG0082","TIG0347","","Record Data","Raise an error if --BODSYS is not empty, --BDSYCD is empty","--BODSYS is not empty and --BDSYCD is empty",TRUE,"predicate","true-duplicate"
"CORE-000025","CG0177","TIG0406","","Record Data","IESTRESC is not equal to IEORRES","IESTRESC is not equal to IEORRES",TRUE,"predicate","true-duplicate"
"CORE-000026","CG0468","TIG0598","","Record Data","When --TPT is present in a dataset, --TPTNUM must also be present.","The --TPTNUM variable does not exist when --TPT does exist.",TRUE,"predicate","true-duplicate"
"CORE-000027","CG0328; CG0329","TIG0496; TIG0497; TIG0141","","Record Data","Either TEENRL or TEDUR must be present for each Element.","At least one of TEENRL and TEDUR must be populated.",TRUE,"predicate","true-duplicate"
"CORE-000028","CG0008","TIG0293","","Record Data","Raise an error when --TPTREF is empty, but --ELTM is not empty","--TPTREF is empty and --ELTM is not empty",TRUE,"predicate","true-duplicate"
"CORE-000029","CG0661","TIG0697","","Record Data","Raise an error when --TPTNUM exists in a dataset and --TPT does not exist.","--TPTNUM exists in a dataset, but --TPT does not exist. When time points are represented in SDTMIG domains, both --TPT a",TRUE,"predicate","true-duplicate"
"CORE-000030","CG0053","TIG0329","","Record Data","Raise and error when --REASND is present in dataset and --PRESP is not present in dataset","--REASND should not be present in dataset when --PRESP is not present in dataset",TRUE,"predicate","true-duplicate"
"CORE-000031","CG0659","","","Record Data","--EVAL must not be used to model QRS data.   This includes the 'QS' and 'FT' domains as well as the 'RS' domain when the record pertains to a Clinical","--EVAL is present.  --EVAL must not be used to model QRS data.",TRUE,"predicate","true-duplicate"
"CORE-000032","CG0660","","","Record Data","--EVALID must not be used to model QRS data.   This includes the 'QS' and 'FT' domains as well as the 'RS' domain when the record pertains to a Clinic","--EVALID is present.  --EVALID must not be used to model QRS data.",TRUE,"predicate","true-duplicate"
"CORE-000033","CG0065","TIG0337","","Record Data","Raise an error when DSTERM = ""COMPLETED"" and DSDECOD not equal to ""COMPLETED"".","DSDECOD is not equal to ""COMPLETED"" when DSTERM equals ""COMPLETED"".",TRUE,"predicate","true-duplicate"
"CORE-000034","CG0069","TIG0339","","Record Data","Raise an error when DSSTDTC is not equal to DM.DTHDTC and DSDECOD is equal to ""DEATH""","DSSTDTC does not equal DM.DTHDTC, when DSDECOD equals ""DEATH"".",TRUE,"predicate","true-duplicate"
"CORE-000035","CG0658","TIG0696","","Record Data","Raise an error when SVPRESP is null and VISITDY is not null.","VISITDY is populated when SVPRESP is null.  VISITDY is the Planned Study Day of a visit. It should not be populated for ",TRUE,"predicate","true-duplicate"
"CORE-000036","CG0657","TIG0695","","Record Data","Raise an error when SVPRESP is ""Y"" and VISIT is not present in TV.VISIT.","Planned visit is not found in TV.",TRUE,"predicate","true-duplicate"
"CORE-000037","CG0653","TIG0691","","Record Data","Raise an error when SVPRESP not ""Y"" or null.","SVPRESP is not null and not equal to ""Y"". Values should be ""Y"" or null.",TRUE,"predicate","true-duplicate"
"CORE-000038","CG0654","TIG0692","","Record Data","Raise an error when SVOCCUR is not null and SVPRESP is not ""Y"".","SVPRESP is not ""Y"" when SVOCCUR is populated.",TRUE,"predicate","true-duplicate"
"CORE-000039","CG0655","TIG0693","","Record Data","Raise an error when SVPRESP=""Y"" and VISITNUM is not in TV.VISITNUM","VISITNUM for planned visit is not in TV.",TRUE,"predicate","true-duplicate"
"CORE-000040","CG0656","TIG0694","","Record Data","Raise an error when SVPRESP is null and VISITNUM is present in TV.VISITNUM","VISITNUM for unplanned visit is present in TV.",TRUE,"narrative","core-is-better"
"CORE-000041","CG0649; CG0459","TIG0689","","Record Data","Raise and error when TSVAL is not populated TSVAL is populated with values or synonyms of values in the ISO 21090 null flavor codelist (or other terms","TSVAL is not populated with an ISO 21090 null flavor or null flavor description but TSVALNF is populated.",TRUE,"narrative","core-is-better"
"CORE-000042","CG0647","TIG0687","","Domain Presence Check","Raise an error when TT dataset is present.","TT dataset is present.",TRUE,"narrative","core-is-better"
"CORE-000043","CG0648","TIG0688","","Domain Presence Check","Raise an error when TP dataset is present.","TP dataset is present.",TRUE,"narrative","core-is-better"
"CORE-000044","CG0646","TIG0686","","Domain Presence Check","Raise an error when SJ dataset is present.","SJ dataset is present.",TRUE,"predicate","true-duplicate"
"CORE-000045","CG0517","TIG0612","","Record Data","Verify ARMNRS is not null when ARMCD is null","ARMNRS value is missing when ARMCD value is missing",TRUE,"narrative","core-is-better"
"CORE-000046","CG0519","TIG0614","","Record Data","Verify ARMNRS is not null when ARM is null","ARMNRS is missing when ARM value is missing",TRUE,"narrative","core-is-better"
"CORE-000047","CG0518","TIG0613","","Record Data","When study does not use multi-stage arm assignments and ARM is populated, ARM must be present in TA.ARM. This rule has been executed to identify all c","ARM value in DM dataset is not among the values of ARM variable in TA dataset. This is allowed only in a multistage stud",TRUE,"predicate","true-duplicate"
"CORE-000048","CG0621","TIG0662","","Record Data","Raise an error when --METHOD is present in an Interventions dataset.","--METHOD is present in an interventions domain.",TRUE,"predicate","true-duplicate"
"CORE-000049","CG0507; CG0622","TIG0602; TIG0663","","Record Data","Raise an error when --USCHFL is present.","--USCHFL is present.",TRUE,"predicate","true-duplicate"
"CORE-000050","CG0623","TIG0664","","Record Data","Raise an error when --RSTIND is present.","--RSTIND is present.",TRUE,"predicate","true-duplicate"
"CORE-000051","CG0624","TIG0665","","Record Data","Raise an error when --RSTMOD is present.","--RSTMOD is present.",TRUE,"predicate","true-duplicate"
"CORE-000052","CG0625","TIG0666","","Record Data","Raise an error when --IMPLBL is present.","--IMPLBL is present.",TRUE,"predicate","true-duplicate"
"CORE-000054","CG0627","TIG0668","","Record Data","Raise an error when --DTHREL is present.","--DTHREL is present.",TRUE,"predicate","true-duplicate"
"CORE-000055","CG0628","TIG0669","","Record Data","Raise an error when --EXCLFL is present.","--EXCLFL is present.",TRUE,"predicate","true-duplicate"
"CORE-000056","CG0629","TIG0670","","Record Data","Raise an error when --REASEX is present.","--REASEX is present.",TRUE,"predicate","true-duplicate"
"CORE-000057","CG0509; CG0630","TIG0604; TIG0671","","Record Data","FETUSID must not be present in SDTM domains.","FETUSID is present.",TRUE,"predicate","true-duplicate"
"CORE-000058","CG0631","TIG0672","","Record Data","Raise an error when RPHASE is present.","RPHASE is present.",TRUE,"predicate","true-duplicate"
"CORE-000059","CG0632","TIG0673","","Record Data","Raise an error when RPPLDY is present.","RPPLDY is present.",TRUE,"predicate","true-duplicate"
"CORE-000060","CG0633","TIG0674","","Record Data","Raise an error when RPPLSTDY is present.","RPPLSTDY is present.",TRUE,"predicate","true-duplicate"
"CORE-000061","CG0634","TIG0675","","Record Data","Raise an error when RPPLENDY is present.","RPPLENDY is present.",TRUE,"predicate","true-duplicate"
"CORE-000064","CG0637","TIG0678","","Record Data","Raise an error when --RPDY is present.","--RPDY is present.",TRUE,"predicate","true-duplicate"
"CORE-000065","CG0638","TIG0679","","Record Data","Raise an error when --RPSTDY is present.","--RPSTDY is present.",TRUE,"predicate","true-duplicate"
"CORE-000066","CG0639","TIG0680","","Record Data","Raise an error when --RPENDY is present.","--RPENDY is present.",TRUE,"predicate","true-duplicate"
"CORE-000067","CG0640","TIG0681","","Record Data","Raise an error when --DETECT is present.","--DETECT is present.",TRUE,"predicate","true-duplicate"
"CORE-000068","CG0641","TIG0682","","Record Data","Raise an error when AGETXT is present.","AGETXT is present.",TRUE,"predicate","true-duplicate"
"CORE-000069","CG0642","TIG0683","","Record Data","Raise an error when SPECIES is present.","SPECIES is present.",TRUE,"predicate","true-duplicate"
"CORE-000070","CG0643","TIG0684","","Record Data","Raise an error when STRAIN is present.","STRAIN is present.",TRUE,"predicate","true-duplicate"
"CORE-000071","CG0644","TIG0685","","Record Data","Raise an error when SBSTRAIN is present.","SBSTRAIN is present.",TRUE,"predicate","true-duplicate"
"CORE-000072","CG0542","","","Record Data","Raise an error when --BEATNO is present.","--BEATNO is present.",TRUE,"predicate","true-duplicate"
"CORE-000073","CG0533","","","Record Data","Raise an error when RPATHCD is present.","RPATHCD is present.",TRUE,"predicate","true-duplicate"
"CORE-000074","CG0508","TIG0603","","Record Data","Raise an error when --IMPLBL is present.","--IMPLBL is present.",TRUE,"predicate","true-duplicate"
"CORE-000075","CG0304","TIG0481","","Record Data","Raise an error when AEREASND is present.","AEREASND is present.",TRUE,"predicate","true-duplicate"
"CORE-000076","CG0302","","","Record Data","Raise an error when TRPORTOT is present.","TRPORTOT is present.",TRUE,"predicate","true-duplicate"
"CORE-000077","CG0301","","","Record Data","Raise an error when TRDIR is present.","TRDIR is present.",TRUE,"predicate","true-duplicate"
"CORE-000078","CG0300","","","Record Data","Raise an error when TRLAT is present.","TRLAT is present.",TRUE,"predicate","true-duplicate"
"CORE-000079","CG0095","","","Record Data","Raise an error when --LOC is not present and --LAT is present.","--LAT is present when --LOC is not present.",TRUE,"predicate","true-duplicate"
"CORE-000080","CG0093","TIG0358","","Record Data","Raise an error when --ELTM, --TPTNUM, and --TPT are not present in dataset, but --TPTREF is present.","--TPTREF is present when --ELTM, --TPTNUM, and --TPT are not present.",TRUE,"predicate","true-duplicate"
"CORE-000081","CG0056","TIG0330","","Record Data","Raise an error when --PRESP is not present but --STAT is present.","--STAT is present when --PRESP is not present.",TRUE,"predicate","true-duplicate"
"CORE-000082","CG0561","","","Record Data","Verify that PESTRESC is null when PEORRES is null","PESTRESC value is not missing when PEORRES value is missing",TRUE,"predicate","true-duplicate"
"CORE-000083","CG0553","TIG0641","","Record Data","Verify that --ORRES is not null when --LOBXFL = Y and --DRVFL= null or --DRVFL is not present in the dataset","--ORRES is missing even though --LOBXFL= ""Y"" and either --DRVFL is not present in dataset or is not equal to ""Y""",TRUE,"predicate","true-duplicate"
"CORE-000084","CG0057","TIG0331","","Record Data","Raise an error when --ENTPT exists in a dataset and --ENRTPT does not exist.","--ENTPT exists in a dataset, but --ENRTPT does not exist.",TRUE,"predicate","true-duplicate"
"CORE-000085","CG0059","TIG0333","","Record Data","Raise an error when --STTPT is completed and --STRTPT is empty","--STTPT is completed and --STRTPT is empty",TRUE,"predicate","true-duplicate"
"CORE-000086","CG0075","TIG0341","","Record Data","Raise an error when DVSTDTC is earlier than RFICDTC in DM.","DVSTDTC is earlier than RFICDTC in DM.",TRUE,"predicate","true-duplicate"
"CORE-000087","CG0387","TIG0549","","Record Data","Raise an error when AESER is completed and value is not 'Y' or 'N'","AESER is completed, but not equal to ""N"" or ""Y""",TRUE,"narrative","core-is-better"
"CORE-000088","CG0149","TIG0169; TIG0390","","Record Data","Verify that the length of value in SETCD variable is <= 8","SETCD value length is greater than 8",TRUE,"predicate","true-duplicate"
"CORE-000089","CG0106","","","Record Data","Raise an error when --TRTV is empty, --VAMT is not empty","Value for --VAMT is populated, when --TRTV is NULL.",TRUE,"predicate","true-duplicate"
"CORE-000090","CG0164","TIG0397","","Record Data","Verify IDVAR is null when RDOMAIN is null","RDOMAIN has a missing value but IDVAR has a non-missing value",TRUE,"predicate","true-duplicate"
"CORE-000091","CG0108","","","Record Data","Raise an error when --TRTV is null, --VAMTU is not null","Value for --VAMTU is populated, when --TRTV is NULL.",TRUE,"predicate","true-duplicate"
"CORE-000092","CG0110; CG0111","TIG0374; TIG0375","","Record Data","Raise an error when --DOSE ^= null and --DOSTXT ^= null.","Both --DOSE and --DOSTXT values are populated",TRUE,"predicate","true-duplicate"
"CORE-000093","CG0114","TIG0377","","Record Data","Raise an error when --DOSU = null and (--DOSE ^= null or --DOSTOT ^= null or --DOSTXT ^= null)","Missing value for --DOSU, when --DOSE, --DOSTXT or --DOSTOT is provided",TRUE,"predicate","true-duplicate"
"CORE-000094","CG0112","TIG0376","","Record Data","Raise an error if --DOSTXT value is numeric.","--DOSTXT value is numeric.",TRUE,"narrative","core-is-better"
"CORE-000095","CG0211","TIG0430","","Record Data","Raise an error when SEUPDES ^= null, ETCD ^= 'UNPLAN'","ETCD is not 'UNPLAN', when SEUPDES is not empty",TRUE,"predicate","true-duplicate"
"CORE-000096","CG0115","TIG0378","","Record Data","Raise an error when --LOC does not exists in a dataset, --PORTOT exists.","--PORTOT variable is present, when --LOC variable does not exist in a dataset.",TRUE,"predicate","true-duplicate"
"CORE-000097","CG0218","TIG0432","","Record Data","Raise an error when variable EPOCH values don't match between Subject Visits (SV) and Subject Elements (SE) datasets.","EPOCH values don't match between Subject Visits (SV) and Subject Elements (SE) datasets.",TRUE,"predicate","true-duplicate"
"CORE-000098","CG0116","TIG0379","","Record Data","Raise an error when --LOC does not exists in a dataset, --DIR exists.","--DIR variable is present, when --LOC variable does not exist in a dataset.",TRUE,"predicate","true-duplicate"
"CORE-000099","CG0422","TIG0577","","Record Data","Raise an error when both --ORRES and --STAT values are populated","Value for --STAT is populated, when --ORRES is populated",TRUE,"predicate","true-duplicate"
"CORE-000100","CG0423","TIG0578","","Record Data","Raise an error when --VAMT is not empty, but --TRTV is empty.","Missing --TRTV value, when --VAMT value is populated.",TRUE,"predicate","true-duplicate"
"CORE-000101","CG0427","TIG0581","","Record Data","Raise an error when --RESCAT is not empty, but --STRESC is empty","Missing --STRESC value, when --RESCAT value is populated.",TRUE,"predicate","true-duplicate"
"CORE-000102","CG0428","TIG0582","","Record Data","Raise an error when --TOX is not empty, but --TOXGR is empty.","--TOXGR should not be null when --TOX is populated.",TRUE,"predicate","true-duplicate"
"CORE-000103","CG0429","TIG0583","","Record Data","Part A - Raise an error when --SCAT is not empty, but --CAT is empty.","--CAT should not be null when --SCAT is populated",TRUE,"predicate","true-duplicate"
"CORE-000104","CG0430","TIG0584","","Record Data","Part A - Raise an error when --SCAT exists in a dataset, but --CAT does not exist.","--SCAT exists in a dataset, but --CAT does not exist.",TRUE,"predicate","true-duplicate"
"CORE-000105","CG0569","TIG0653","FB2602","Record Data","Raise an error when --LOBXFL = 'Y' and --STRESC is empty.","--LOBXFL = 'Y', but --STRESC is empty.",TRUE,"predicate","true-duplicate"
"CORE-000106","CG0045","TIG0324","","Record Data","Raise an error when --ENTPT is completed and --ENRTPT is not completed.","--ENTPT is completed, but --ENRTPT is not completed.",TRUE,"predicate","true-duplicate"
"CORE-000107","CG0554","TIG0642","","Record Data","APID is required in all Associated Persons Data. In addition to STUDYID, DOMAIN, and --SEQ being required for all domains based on one of the 3 genera","An appropriate identifier is not present; USUBJID, APID, SPDEVID, SPTOBID, POOLID, SPTOBID, STOCONID should be present.",TRUE,"narrative","core-is-better"
"CORE-000108","CG0133","TIG0382","FB0602","Record Data","When a record is present in the DD dataset then death flag (DTHFL) should be populated as 'Y' in the DM dataset for the corresponding subject.","DD record is present, but DTHFL in DM dataset is not ""Y"".",TRUE,"predicate","true-duplicate"
"CORE-000109","CG0547","","","Record Data","Raise an error when SMSTDTC is null.","SMSTDTC is null.",TRUE,"predicate","true-duplicate"
"CORE-000110","CG0549","TIG0637","","Record Data","Raise an error when (--ORREF ^= null or --DRVFL='Y') and --STREFC is null.","--STREFC is null when --ORREF is non-empty or --DRVFL is equal to 'Y'",TRUE,"predicate","true-duplicate"
"CORE-000111","CG0564","TIG0649","","Record Data","Raise an error when --AGENT is present in a dataset other than MS.","--AGENT is present in a dataset other than MS.",TRUE,"predicate","true-duplicate"
"CORE-000112","CG0565","TIG0650","","Record Data","Raise an error when --CONC is present in a dataset other than MS.","--CONC is present in a dataset other than MS.",TRUE,"predicate","true-duplicate"
"CORE-000113","CG0566","TIG0651","","Record Data","Raise an error when --CONCU is present in a dataset other than MS.","--CONCU is present in a dataset other than MS.",TRUE,"predicate","true-duplicate"
"CORE-000114","CG0567","TIG0652","","Record Data","Raise an error when --EVDTYP is present in a dataset other than MH.","--EVDTYP is present in a dataset other than MH.",TRUE,"predicate","true-duplicate"
"CORE-000115","CG0570","","","Record Data","Raise an error when ARM is 'Screen Failure', 'Not Assigned', 'Unplanned Treatment', 'Not Treated'","ARM cannot be equal to 'Screen Failure', 'Not Assigned', 'Unplanned Treatment' or 'Not Treated'.",TRUE,"narrative","core-is-better"
"CORE-000116","CG0619","TIG0660","","Record Data","Raise an error when --SPCUFL is not null or equal to ""N""","--SPCUFL is not null or equal to 'N'",TRUE,"narrative","core-is-better"
"CORE-000117","CG0081","TIG0346","","Record Data","Raise an error when --STAT not equal to 'NOT DONE' when --PRESP = 'Y' and --OCCUR is null","--STAT should equal 'NOT DONE' when --PRESP = 'Y' and --OCCUR = null",TRUE,"narrative","core-is-better"
"CORE-000118","CG0404","TIG0562","","Record Data","Raise an error when --PRESP is equal to 'Y' and --OCCUR is empty and --STAT is not present in dataset.","--STAT is not present in dataset when --PRESP is equal to ""Y"" and --OCCUR is blank",TRUE,"narrative","core-is-better"
"CORE-000119","CG0521","TIG0616","","Record Data","Raise an error when ARM is not empty, but ARMCD is empty","ARM is populated, when ARMCD is NULL",TRUE,"predicate","true-duplicate"
"CORE-000120","CG0522","TIG0617","","Record Data","Raise an error when ACTARM is not empty, but ACTARMCD is empty","ACTARM is populated, when ACTARMCD is NULL",TRUE,"predicate","true-duplicate"
"CORE-000121","CG0520","TIG0615","","Record Data","Verify the value for ARMNRS, when both ARMCD and ACTARMCD values are populated","Value for ARMNRS is populated, when both ARMCD and ACTARMCD values are populated",TRUE,"narrative","core-is-better"
"CORE-000122","CG0434","TIG0586","","Record Data","Raise an error when AGEU is completed but both AGETXT and AGE are not completed.","AGEU is completed, but both AGE and AGETXT are not completed.",TRUE,"predicate","true-duplicate"
"CORE-000123","CG0388","TIG0550","","Record Data","Raise an error when AESCAN is completed and value is not 'Y' or 'N'","AESCAN is completed, but not equal to ""N"" or ""Y""",TRUE,"narrative","core-is-better"
"CORE-000124","CG0389","TIG0551","","Record Data","Raise an error when AESCONG is completed and value is not 'Y' or 'N'","AESCONG is completed, but not equal to ""N"" or ""Y""",TRUE,"narrative","core-is-better"
"CORE-000125","CG0390","TIG0552","","Record Data","Raise an error when AESDISAB is completed and value is not 'Y' or 'N'","AESDISAB is completed, but not equal to ""N"" or ""Y""",TRUE,"narrative","core-is-better"
"CORE-000126","CG0391","TIG0553","","Record Data","Raise an error when AESDTH is completed and value is not 'Y' or 'N'","AESDTH is completed, but not equal to ""N"" or ""Y""",TRUE,"narrative","core-is-better"
"CORE-000127","CG0392","TIG0554","","Record Data","Raise an error when AESHOSP is completed and value is not 'Y' or 'N'","AESHOSP is completed, but not equal to ""N"" or ""Y""",TRUE,"narrative","core-is-better"
"CORE-000128","CG0393","TIG0555","","Record Data","Raise an error when AESLIFE is completed and value is not 'Y' or 'N'","AESLIFE is completed, but not equal to ""N"" or ""Y""",TRUE,"narrative","core-is-better"
